{
  "schema_version": 1,
  "id": "2026-10-22-tts-apple-speaker-calibration",
  "title": "macOS voice: physical speaker-to-microphone calibration",
  "date": "2026-10-22",
  "category": "tts",
  "status": "partial",
  "scope": "Historical two-request collector calibration using converted16k microphone buffers; superseded by native-format microphone observation.",
  "summary": "Original collector returned1247ms then299ms microphone pickup. Later loaded tests exposed converted-buffer host-window regressions; these historical values are not current qualified speaker timing or default evidence.",
  "environment": {
    "hardware": "Apple M3 MacBook Air,16GB RAM",
    "os": "Version 27.2 (Build 26B5091g)",
    "workload": "Apple-only physical calibration; no ASR load; not model-ranking or default evidence. Built-in microphone and speakers; current hardware volume retained.",
    "cold_warm": "One first request after preparation; one varied subsequent phrase. OS service caches not hardware-cold.",
    "audio_route": "Built-in microphone and speakers; source volume0.75. Existing hardware volume retained; not sampled at the exact trial boundaries.",
    "power_thermal": "Not continuously sampled; no claim of a controlled thermal/power state."
  },
  "provenance": {
    "binary_sha256": "32a35bfcf9220dbdc87734466ccd63b9df1dc0a5e2488d1541b7e08a4207c8ed",
    "model_revision": "AVSpeechSynthesizer/system-default",
    "fixture_sha256": "89bc2cbbb042d3eac7a0fbf040798d0828cdb2b2a4128795042218ef22e1b2ad",
    "command": "PYTHONDONTWRITEBYTECODE=1 python3 Tools/tts_compare.py --app '/Users/sergekadjo/Library/Caches/NextNotesBuild/install-36587/Next Notes.app/Contents/MacOS/NextNotes' --output Tests/Reports/tts-2026-10-22/speaker-calibration --engines apple --trials 1 --speaker-output --timeout 35 --relay-owner codex-tts-20261022 --max-swap-gb 12 --workload 'Apple-only physical calibration; no ASR load; not model-ranking or default evidence. Built-in microphone and speakers; current hardware volume retained.'",
    "grader": "Native captured host timestamps; >=0.75 rendered/microphone envelope correlation; quiet baseline, threshold and route/drop gates. No microphone recording saved."
  },
  "metrics": [
    {
      "name": "First-after-preparation microphone pickup",
      "value": 1246.5490833333333,
      "unit": "ms",
      "boundary": "Text request \u2192 correlated microphone pickup, above frozen detector threshold.",
      "samples": 1,
      "aggregation": "single observation"
    },
    {
      "name": "First-after-preparation non-silent render",
      "value": 1170.6015,
      "unit": "ms",
      "boundary": "Text request \u2192 first post-gain rendered sample >=0.001 amplitude, native host timestamp.",
      "samples": 1,
      "aggregation": "single observation"
    },
    {
      "name": "First-after-preparation estimated presentation",
      "value": 1172.1431666666667,
      "unit": "ms",
      "boundary": "Text request \u2192 render timestamp + queried maximum downstream presentation-latency estimate; not observed acoustic output.",
      "samples": 1,
      "aggregation": "single observation"
    },
    {
      "name": "Subsequent phrase microphone pickup",
      "value": 299.17245833333334,
      "unit": "ms",
      "boundary": "Text request \u2192 correlated microphone pickup, above frozen detector threshold.",
      "samples": 1,
      "aggregation": "single observation"
    },
    {
      "name": "Subsequent phrase non-silent render",
      "value": 207.92954166666667,
      "unit": "ms",
      "boundary": "Text request \u2192 first post-gain rendered sample >=0.001 amplitude, native host timestamp.",
      "samples": 1,
      "aggregation": "single observation"
    },
    {
      "name": "Subsequent phrase estimated presentation",
      "value": 209.47120833333332,
      "unit": "ms",
      "boundary": "Text request \u2192 render timestamp + queried maximum downstream presentation-latency estimate; not observed acoustic output.",
      "samples": 1,
      "aggregation": "single observation"
    }
  ],
  "limitations": [
    "Superseded collector:16k converted microphone windows can overlap under decoder load. Current speaker tests observe native48k hardware-format buffers. Original numbers are retained as diagnostic history, not current physical acceptance.",
    "Calibration only: n1 per phase; no median/tail or fastest-default conclusion.",
    "Microphone onset uses10ms energy windows and >max(0.001RMS,4x room baseline); it is not human perceptual onset.",
    "Native render and maximum presentation-latency estimate are separate from actual microphone observation.",
    "No concurrent ASR/EOU/normal voice conversation, no route matrix or double-talk qualification."
  ],
  "sources": [
    "Tests/Reports/tts-2026-10-22/speaker-calibration/apple.json",
    "Tests/Reports/tts-2026-10-22/speaker-calibration/summary.json",
    "Tests/Reports/tts-2026-10-22/README.md",
    "Tests/Reports/tts-2026-10-22/microphone-authorization-probe.json"
  ],
  "publication": {
    "approved": true,
    "reviewed_by": "Codex TTS: historical scope corrected after native-clock producer investigation",
    "reviewed_on": "2026-10-22"
  }
}
